mention_id;mention_text;doc_id;sentence_id;begin_index;end_index
M1306   ;READ become political punch bag race call counterpart maintain communication do not signal new phase relationship high-level contact Russian military other matter still remain hold;A138;O15     ;0;24
M1307   ;Officials say call wa initiate request Russian government raise question imminent Russian military action be;A138;O16     ;0;14
M1308   ;official tell Russian jet have arrive;A138;O17     ;2;5
M1309   ;be unclear aircraft eventually be use;A138;O18     ;1;5
M1310   ;Prior development have observe Russian military helicopter airbase be beef see tank mobile artillery armor vehicle nation;A138;O19     ;0;16
M1311   ;tell recent Russian military buildup be defensive nature aim support Russian obligation regime Syrian al-Assad senior official tell reporter;A138;O2      ;1;18
M1312   ;defense official do not rule future discussion official Russian support mission even oppose support;A138;O20     ;1;13
M1401   ;say investigation be murder case woman child;A143;O14     ;3;6
M1313   ;be unclear next step U.S.-Russian military relationship be official say further talk be aim try avoid misunderstand relationship;A138;O21     ;2;17
M1314   ;be begin conversation official say;A138;O22     ;2;4
M1315   ;policy be close ally leave office order resolve years-long civil war official have warily watch military support Syrian regime;A138;O3      ;2;18
M1316   ;However aircraft also operate country root be important power coordinate military presence avoid accidental encounter;A138;O4      ;0;14
M1317   ;intelligence official call Russian buildup significant say represent first major expeditionary force deployment former Soviet space ha undertake war;A138;O5      ;1;18
M1318   ;Reports indicate military buildup consist combat aircraft be capable strike grind target close air support intercept aircraft small number main battle tank armor personnel carrier transport troop battlefield;A138;O6      ;0;27
M1319   ;ultimate intention be unclear initial sign suggest focus provide air support Syrian force humanitarian relief operation;A138;O7      ;2;15
M1320   ;also expect send small presence grind force support operation;A138;O8      ;2;8
M1321   ;intelligence official add challenge be maintain presence grind require robust force come direct combat various force region;A138;O9      ;1;16
M1322   ;Users customer abandon virtual sale due fall social network;A139;O1      ;0;8
M1323   ;fall point stock buy decline record fresh 52-week low nervousness interest rate hike 24-hour power supply village be celebrate year house have electricity sa factor weigh Indian market expert be view be possibility slip go hit ne keen strengthen partnership today say be keen further strengthen partnership ha double investment count founder Making legend wa really come own apply intellect solve real world problem use read more offer cr 's acche din senior faculty » see le aloof more engage party affair hit back set crore sale target fiscal sell good worth cr fiscal nobody be even half company hea Indian engineer startup skyTran get investment chairman skyTran have network computer control levitate 'jet-like vehicle transport passenger abo ten midcap stock investor look now index ha rally cent last year compare cent fall see t founder Making legend wa really come own apply intellect solve real world problem use look opaque benefit market Shares slide job data share slide fourth weekly loss last boost supportive-sounding European fall pt stock buy decline record fresh 52-week low nervousness interest rate hike work create conducive biz environment say be very critical employment policy take centre stage development goal gr Nearly lakh a/c holder avail overdraft More crore have be mobilise crore debit | 25201.90↓-562.88NIFTY 7655.05↓-167.95USD/INR 60.16↓-0.18GOLD;A14 ;O1      ;16;212
M1324   ;end pt down see biggest weekly loss equity benchmark slump point cent hit new 52-week low cap surge acquisition worth share climb % morning trade company say UK-based subsidiary acquire % missile sink aircraft carrier iPhone rumour do roundsWhat be drive migrant European country thing know more slideshowsFROM seek rate cut say fit face global tumult ha weigh side rate cut say there be room moderation interest rate i outsource work Chinese live separate colony city be see interact local population money law Beneficiaries overseas discretionary trust face enquiry income-tax department expect beneficiary undisclosed offshore trust come clean declare bl set buy American business People close transaction say buy wholly own subsidiary search engine conglomerate scout invest Indian startup be most popular search engine;A14 ;O2      ;2;123
M1325   ;company be list ha market cap bn;A14 ;O3      ;1;6
M1326   ;Fosun be MORE LINKS Gainers|Losers|Movers|Only weekly round-up top news view mutual fund industry;A14 ;O4      ;0;12
M1327   ;Markets Watch stock currency bond money real estate market latest investment option inbox;A14 ;O5      ;0;12
M1328   ;news personal finance stock property gold tax plan more;A14 ;O6      ;2;8
M1329   ;see blog http //ambedkaractions.blogspot.in/ http //palashscape.blogspot.in/ free request forward newsletter list friend;A14 ;O7      ;7;11
M1330   ;police shoot dead morning suspect shoot have be describe men white black enforcement scour area officer body wa find do not find men search suspect continue overnight early morning small northern community mourn popular veteran police officer wa fatally shoot duty authority scour area overnight search men want slay;A140;O1      ;11;48
M1331   ;Authorities say radio morning tell dispatcher wa chase men foot;A140;O10     ;0;9
M1332   ;Communication wa lose soon;A140;O11     ;0;3
M1333   ;backup arrive shortly thereafter find injure gunshot wind say;A140;O12     ;1;8
M1334   ;die injury say;A140;O13     ;1;2
M1335   ;emotional describe slay officer personal friend three-decade member department father son;A140;O14     ;1;10
M1336   ;'We lose family member say 52-year-old officer know town 'GI;A140;O15     ;0;9
M1337   ;commitment people community ha be unmatched be dearly miss;A140;O16     ;1;8
M1338   ;area border area be popular boat other outdoor pursuit forest preserve chain lake partly encircle;A140;O17     ;1;14
M1339   ;longtime city dweller move region be normally quieter lifestyle;A140;O18     ;1;8
M1340   ;Authorities urge resident area stay home conduct search men white other black aid canine helicopter;A140;O19     ;0;14
M1341   ;Helicopters be aid officer early manhunt village suspect fatal shoot stretch second day sheriff office spokesman say;A140;O2      ;0;16
M1342   ;service local commuter train wa halt resident want take dog relieve be tell stay home — job walk pet handle police officer;A140;O20     ;1;21
M1343   ;manhunt be underway suburb police officer wa reportedly shoot dead routine patrol;A140;O21     ;1;11
M1344   ;Heavily arm officer prepare head search suspect men be see town try hunt suspicious men arm suspect white black be large follow shoot area;A140;O22     ;0;23
M1345   ;Hundreds member law enforcement have be send area join search sniper lookout stand top roof search men follow kill officer;A140;O23     ;0;19
M1346   ;Reports suggest wa 32-year veteran department police helicopter be deploy search launch officer wa kill morning patrol police helicopter patrol swampy area sniper perch top roof search area;A140;O24     ;0;27
M1402   ;Investigations be dismiss anticipatory bail plea dismiss former law minister anticipatory bail plea domestic violence case file wife India-Irish bilateral tie expect reach greater height visit ha say bilateral relation be expect reach greater height visit;A143;O15     ;1;35
M1403   ;key component Indo-US relation say energy key strategic component bilateral relationship;A143;O2      ;4;10
M1347   ;ha also establish two-mile no-fly zone helicopter hover close grind cause grass fly arm officer hold position set train track law enforcement member eye leave heavily-armed officer walk grass search arm suspect shoot police officer enforcement member helicopter scan tree line suspect flee scene wake shoot helicopter involve huge manhunt touch down field next set train track spotter be station various rooftop area bid find escape gunman be see leave house search area afternoon;A140;O25     ;2;73
M1348   ;be lock fear arm suspect policewoman walk many block road area surround shoot heavy weapon be see get ready flush suspect have not be see kill image member search sit railway line helicopter fly overhead dog unit wa hunter be operate be mile north heavily-armed officer join search suspect heavily-wooded marshy area unit arrive scene;A140;O26     ;1;54
M1349   ;area ha be place lock commuter train go community have be suspend be spot railway track search area;A140;O27     ;1;17
M1350   ;shoot wa main highway connect outer suburb officer wa shoot normally peaceful community around mile north officer gather search suspect police officer wa shoot dead cop point area field patrol car Several school be place lockdown precaution accord;A140;O28     ;1;37
M1351   ;area school cancel class say;A140;O29     ;5;4
M1352   ;Authorities state region pour village mile north shoot morning wear tactical gear tot high-powered rifle;A140;O3      ;0;14
M1353   ;death be third law enforcement fatality year accord;A140;O30     ;2;7
M1354   ;say firearms-related death be down percent year compare same period last year be last year year;A140;O31     ;1;15
M1355   ;resident express own sorrow death immensely popular;A140;O32     ;4;6
M1356   ;particular officer be pillar community definitely go be miss touch so many life say 40-year-old teacher life community;A140;O33     ;1;17
M1357   ;Dozens gather hour street village show support law enforcement officer;A140;O34     ;0;9
M1358   ;Thirty-year-old hold sign say Lives;A140;O35     ;0;4
M1359   ;life couple mile away say officer come even thank crowd;A140;O36     ;1;9
M1360   ;22-year-old student say felt compel come other recent police shooting;A140;O37     ;4;9
M1361   ;hold sign say;A140;O38     ;1;2
M1362   ;agency team police dog assist search suspect spokesman;A140;O4      ;1;7
M1363   ;say;A140;O5      ;2;0
M1364   ;search men allegedly shoot dead police officer continue night;A140;O6      ;1;8
M1365   ;police helicopter search light scour area men disappear Authorities state region pour village mile north shoot morning police officer victim ha be identify volunteer www.opperationofficerdown.org demonstrate support police shoot officer hold sign police continue search suspect shoot police officer wa shoot kill pursue group suspicious men Officers be see take position rooftop railroad track terrain rifle scope binoculars;A140;O7      ;2;57
M1366   ;Others lean helicopter weapon ready;A140;O8      ;0;4
M1367   ;Residents be urge stay indoors school be put lockdown;A140;O9      ;0;8
M1368   ;APT be offer saving new brochure;A141;O1      ;0;5
M1369   ;APT be offer saving new brochure;A141;O2      ;0;5
M1370   ;example book 11-day tour receive air credit couple;A141;O3      ;1;7
M1371   ;trip explore track go most northerly point Australian mainland well give full-day behind-the-scenes access;A141;O4      ;1;13
M1372   ;price be person twin share;A141;O5      ;1;4
M1373   ;Book be eligible air credit offer;A141;O6      ;0;5
M1374   ;Phone;A141;O7      ;0;0
M1375   ;See story first appear;A141;O8      ;0;3
M1376   ;star ha say be happy live life single woman;A142;O1      ;1;8
M1377   ;’ ll become actor child be college. ’ think ‘ ’ re live dream mine ’ course woman stay home raise child – wa way wa – wa Is be ”;A142;O10     ;1;30
M1378   ;Magazine/PA say land role open so many door philosophy idea ”;A142;O11     ;0;10
M1379   ;u – be unemployed actor happen get job job wa;A142;O12     ;3;9
M1380   ;have idea wa go be successful be here be try best ’ ” co-star famous play die;A142;O13     ;1;16
M1381   ;“ laugh day say;A142;O14     ;0;3
M1382   ;“ day wa different funny;A142;O15     ;0;4
M1383   ;wa bear entertainer;A142;O16     ;1;2
M1384   ;wa just magic happen u;A142;O17     ;1;4
M1385   ;know meet someone feel ’ ve know forever;A142;O18     ;1;7
M1386   ;’ s wa like. article Read full article;A142;O19     ;1;7
M1387   ;tell;A142;O2      ;1;0
M1388   ;out now;A142;O20     ;0;1
M1389   ;magazine “ lot woman be content own don t want partner;A142;O3      ;0;10
M1390   ;want freedom;A142;O4      ;1;1
M1391   ;love flirt doesn ’ t mean ’ re go bring person home have sleepover. ”;A142;O5      ;2;14
M1392   ;Magazine/PA also speak previous marriage year art director struggle live dream be actress;A142;O6      ;0;12
M1393   ;“ don ’ t word abusive wa just live life know live ” say;A142;O7      ;0;13
M1394   ;“ wa creative guy part dream wa want be cowboy run ranch horse so child be little move out here house design build together have horse chicken;A142;O8      ;0;26
M1395   ;“ Then announce want live dream answer wa;A142;O9      ;0;7
M1396   ;cusp transformation do business globally say say be undergo massive transformation term do business globally;A143;O1      ;2;14
M1397   ;"";A143;O10     ;0;0
M1398   ;try curtail freedom expression criticise BJP-led implement then take U-turn say rule dispensation be India-US joint effort be define partnership 21st century ha say joint effort make define partnership 21st century;A143;O11     ;0;30
M1399   ;joint effort relationship define natural synergy democracy ha say relationship be define natural synergy democracy easy identification people;A143;O12     ;2;17
M1400   ;pay homage undisputed champion pay tribute describe late chief 'undisputed heavyweight champion Indian cricket team ask advise cooperate investigation chairperson ask advise cooperate police investigation have be more up-front case say leader question have decide not pursue domestic violence case leader probe murder case say;A143;O13     ;3;44
M1404   ;be leave two-nation trip tomorrow leave two-nation tour morning;A143;O3      ;2;8
M1405   ;arrive tomorrow hold ask explain controversial statement say have ask president explain party position controversial statement make actor-turned-BJP conduct conduct two-day 'Global here begin tomorrow;A143;O4      ;4;24
M1406   ;chair event first day write say ready walk extra mile write letter seek help resolve issue;A143;O5      ;7;15
M1407   ;letter refute news report allege award contract tender ha emphatically deny news report issue contract tender;A143;O6      ;2;15
M1408   ;state be grave factual demand probe mysterious killing chairman demand probe mysterious killing;A143;O7      ;1;12
M1409   ;People want know be sanction partnership higher education give approval sign minor amendment earlier memorandum expand operation city Home;A143;O8      ;1;18
M1410   ;fast-growing Non-Banking aim drive credit penetration offer stay summon issue inflammatory speech stay summon issue court allegedly make inflammatory speech general election;A143;O9      ;6;21
M1411   ;heaviest s dad wa lb;A144;O1      ;2;4
M1412   ;sit meal matter ’ d cook be set nice plate perhaps serve tea eat “ ladies. ” grandmother really drill head food be love food be happiness everything ha have smell ” say;A144;O10     ;4;32
M1413   ;“ smell ha aroma—it ’ s go transform world. ” s family move wa leave wa harder stay positive;A144;O11     ;0;18
M1414   ;send recipe card new home;A144;O12     ;3;4
M1415   ;“ grandmother ’ s recipe card save life keep get trouble;A144;O13     ;0;10
M1416   ;week have purpose mission ” say;A144;O14     ;1;5
M1417   ;“ have go home have recipe card have cook sister…and know have take care myself nobody else would. combine teaching cook life be s throw style baker s carefully-measured approach take care own family;A144;O15     ;0;33
M1418   ;memory s healthy swap switch butter applesauce help inspire start nutrition awareness program offer workshop create healthier lifestyle young child adult;A144;O16     ;1;20
M1419   ;food s loom presence formative year s path become nutritionist wasn t exactly direct;A144;O17     ;2;13
M1420   ;go several profession first include act commercial work school drama therapist kid suffer depression low self-esteem;A144;O18     ;1;15
M1421   ;“ work school realize important proper food choice be ” say;A144;O19     ;0;10
M1422   ;try lose weight time—every week engage new diet more successful others nothing stick;A144;O2      ;1;12
M1423   ;“ work kid importance food choice make snack help parent add nutrient-loaded food child s diet get rid sugar preservative artificial additives. However wasn ’ t couple year later dad wa diagnose cancer go back school study nutrition;A144;O20     ;0;37
M1424   ;“ realize help people heal food choice wa true call say;A144;O21     ;0;10
M1425   ;creative yet practical approach bring student guide cook own child well;A144;O22     ;1;10
M1426   ;daughter ’ s first day preschool notice many classmate be eat unhealthy snack;A144;O23     ;2;12
M1427   ;start blog share healthy recipe cook trick start bring treat daughter ’ s classroom show healthy cook taste good;A144;O24     ;1;18
M1428   ;“ daughter go preschool border many kid have never see edamame avocado say;A144;O25     ;0;12
M1429   ;“ make guacamole edamame hummus;A144;O26     ;0;4
M1430   ;teach cook turn thier yucks yums. ” blog gain traction try sell book idea;A144;O27     ;1;13
M1431   ;response receive wa largely “ s not story;A144;O28     ;2;7
M1432   ;want hear family. ” begin write grow up fat dad blog post form basis book;A144;O29     ;1;14
M1433   ;“ corner house wa wall space ” say;A144;O3      ;0;7
M1434   ;wa little hesitant explore relationship father;A144;O30     ;1;5
M1435   ;send chapter ’ d finish write look call process “ nerve-wracking. However father ’ s response read book wa “ ’ ve come long way baby tagline ’ d create;A144;O31     ;1;29
M1436   ;ha find story resonate many ’ s receive letter people world ’ ve have grandmother have parent wrestle extreme diet;A144;O32     ;1;19
M1437   ;“ story be everybody s story be story most important thing be try create good food memory kid be aware message send child ” say;A144;O33     ;0;24
M1438   ;“ love food buy food make food food value doe body;A144;O34     ;0;10
M1439   ;put body be ’ re go live life;A144;O35     ;2;7
M1440   ;’ ve get treat body well. ” learn more visit penguin.com;A144;O36     ;1;10
M1441   ;post appear first;A144;O37     ;1;2
M1442   ;“ wall ] line floor ceiling diet book shirt represent dad s different weight;A144;O4      ;0;13
M1443   ;wa pile nutrition expert cook teacher mom-of-two reflect tumultuous childhood relationship food affect relationship family recent memoir aptly;A144;O5      ;1;17
M1444   ;book describe creative family—her mother sister be actress father work advertise writer creative director responsible iconic slogan such “ always obsess food never healthy way;A144;O6      ;2;24
M1445   ;dad diet then maybe eat entire pizza then switch diet mom prepare either process food nothing;A144;O7      ;1;15
M1446   ;wa s grandmother show prepare correctly food be source joy rather stress;A144;O8      ;1;11
M1447   ;s grandmother people call cook traditional Jewish meal encourage make food art rather temporary sustenance;A144;O9      ;2;14
M1448   ;be scroll s fee not recognize most photo;A145;O1      ;2;7
M1449   ;challenge be just fun;A145;O10     ;2;3
M1450   ;So far manage rack follower;A145;O11     ;0;4
M1451   ;Check work;A145;O12     ;0;1
M1452   ;"";A145;O13     ;0;0
M1453   ;’ s makeup artist ha ability transform celebrity character choice use makeup;A145;O2      ;1;11
M1454   ;Not everyone be artistically gift;A145;O3      ;0;4
M1455   ;artist manage transform everyone toupée-wearing even channel look exactly;A145;O4      ;1;8
M1456   ;"";A145;O5      ;0;0
M1457   ;recent interview reveal average ’ d say take 30-45 minute [ complete look;A145;O6      ;2;12
M1458   ;know look aren t perfect;A145;O7      ;2;4
M1459   ;style be really theatrical don ’ t spend ton time blend;A145;O8      ;1;10
M1460   ;want work future;A145;O9      ;1;2
M1461   ;come wa consider standard ultra-portable notebook;A146;O1      ;4;5
M1462   ;new laptop also feature s new high-resolution touch screen. ” main thing hold back much-disliked operate system;A146;O10     ;1;16
M1463   ;However now device come much-acclaimed continue take customer have normally purchase;A146;O11     ;0;10
M1464   ;However ’ s not just device be take attention away;A146;O12     ;0;9
M1465   ;Earlier year release ultra-light 12-inch ha screen update design;A146;O13     ;0;8
M1466   ;say device really kill be iPad due be announce week;A146;O14     ;2;9
M1467   ;“ Effectively iPad be turn killer product rival similarly size other laptop;A146;O15     ;0;11
M1468   ;’ s assume partner deliver software side. ” software side be huge issue give iPad t be run full desktop operate system;A146;O16     ;1;21
M1469   ;However be more adequate many just need device word process surf multimedia capability;A146;O17     ;0;12
M1470   ;always have place technology history even isn ’ quite relevant wa year ago;A146;O18     ;4;12
M1471   ;[ iPad be article;A146;O19     ;0;3
M1472   ;take couple year commercial acceptance take way nobody have ever expect;A146;O2      ;3;10
M1473   ;lead creation compete none device come close match s success;A146;O3      ;3;9
M1474   ;Things have change past couple year not be unique device use be;A146;O4      ;0;11
M1475   ;s take couple generation take release wa first device wa easily see killer;A146;O5      ;2;12
M1476   ;write article last year topic;A146;O6      ;2;4
M1477   ;“ appear be be put competition product iPad;A146;O7      ;0;7
M1478   ;Based few review gather s latest baby be killer. ” Then be think wa much better buy;A146;O8      ;0;16
M1479   ;“ s new be killer shoehorn 13-inch screen bezel normally hold 11-inch panel;A146;O9      ;0;12
M1480   ;child be sick need prescription medication need know correct dosage often give be take meal course side effect;A147;O1      ;2;17
M1481   ;More “ s patient day pharmacy need be not be meet ’ re not be meet way be medication isn t customize ” say vice president formulation;A147;O10     ;0;26
M1482   ;Today majority medication kid be compound especially give child cardiology neonatal department hospital say;A147;O11     ;0;13
M1483   ;compound pharmacy change concentration dosage make suspension liquid add flavor make more palatable;A147;O12     ;1;12
M1484   ;also help child need specific medication be currently unavailable market;A147;O13     ;2;9
M1485   ;example compound pharmacy work doctor ensure infant be sensitive medication contain several drug be treat medication ha minimal side effect say;A147;O14     ;1;20
M1486   ;Likewise compound pharmacy create unique concoction mix type cream together skin condition example;A147;O15     ;0;12
M1487   ;medication also be reformulate exclude ingredient gluten dye child be allergic child ’ t tolerate side effect;A147;O16     ;1;16
M1488   ;Is compound safe;A147;O17     ;0;2
M1489   ;have be concern recent year safety compound pharmacy incident people develop fungal meningitis other infection die contaminate steroid dispense;A147;O18     ;1;18
M1490   ;“ be essentially act manufacturer disguise compounder wa total neglect certainly not fair representation average compounder genuinely care patient say chief operate officer;A147;O19     ;0;22
M1491   ;Yet probably never give much think be actually medication ’ s prepare;A147;O2      ;0;11
M1492   ;drug manufacturer be regulate compound pharmaceutical industry be regulate individual state;A147;O20     ;1;10
M1493   ;Nevertheless be strict guideline include key standard compound pharmacy follow;A147;O21     ;0;9
M1494   ;be sterile non-sterile preparation other be “ good compound practice rule regulation state follow;A147;O22     ;1;13
M1495   ;sign law;A147;O23     ;5;1
M1496   ;law compound pharmacy be encourage register;A147;O24     ;2;5
M1497   ;Once do be classify outsource facility sell bulk drug hospital healthcare center s know “ office use. pharmacy also be subject current good manufacture practice regulation inspection;A147;O25     ;0;26
M1498   ;Yet registration be voluntary not pharmacy be regulate;A147;O26     ;0;7
M1499   ;“ medical community s hope be become more more safe compound pharmacy be treat manufacturer emergency medicine physician pediatrician need know child be prescribe medication ask pediatrician medicine be necessary particular formulation;A147;O27     ;0;31
M1500   ;Also only thing be be change be flavor find there be way make medication more palatable use compound pharmacy;A147;O28     ;0;18
M1501   ;’ s also good idea check insurance company not cover medication have stipulation specific formulation;A147;O29     ;1;14
M1502   ;surprise be prescription actually be customize child technology know compound;A147;O3      ;2;9
M1503   ;doctor have relationship compound pharmacy hand prescription let find;A147;O30     ;1;8
M1504   ;way ask pharmacist have have problem compound pharmacy;A147;O31     ;1;7
M1505   ;also check s website inspection recall;A147;O32     ;2;5
M1506   ;find reputable compound pharmacy area search Pharmacists look pharmacy hold accreditation only percent do;A147;O33     ;1;13
M1507   ;“ prof be meet exceed compound standard regulation ensure product be quality ’ re safe ” say;A147;O34     ;0;16
M1508   ;be health journalist consultant provide content market copywriting service healthcare industry;A147;O35     ;2;10
M1509   ;’ s also mom;A147;O36     ;1;3
M1510   ;more revelantwriting.com;A147;O37     ;1;1
M1511   ;Find compound pharmaceutical be help child get well need do make sure ’ re safe;A147;O4      ;0;14
