mention_id;mention_text;doc_id;sentence_id;begin_index;end_index
M2563   ;Not ’ ve hear;A184;O29     ;0;3
M2564   ;nomination be prize then deliver flame torch scornful interviewer partisan defender light night sky painful distortion;A184;O3      ;3;15
M2565   ;Demanding universal health care strictly regulate price close corporate health providers—- only humanize act profitable public utility;A184;O30     ;0;16
M2566   ;many corporate giant go bankrupt serve;A184;O31     ;1;5
M2567   ;"";A184;O32     ;0;0
M2568   ;underestimate be greatly hate ideology especially import system repellent;A184;O33     ;2;8
M2569   ;Only horror communism outpoint socialism hall shame “ slam-dunk ” cudgel laughably slam “ socialism ” pay slavish minority;A184;O34     ;0;18
M2570   ;Winning candidate shy rigid systemic abstraction offend group predictable offset history political party;A184;O35     ;0;12
M2571   ;Sure vision triumph empty pledge work not rigid fixation ideological rectitude;A184;O36     ;0;10
M2572   ;Sanders be anything ideologue otherwise — le democratic socialist ” democratic capitalist. ” agenda redeem even rationalize tarnish capitalism;A184;O37     ;0;18
M2573   ;Does preach end capitalism even far drastic systemic change;A184;O38     ;0;8
M2574   ;Does Sanders impugn produce too much pollution fossil fuel thus top environmental solution;A184;O39     ;0;12
M2575   ;Does Sanders talk nationalize major industry;A184;O4      ;0;5
M2576   ;Does Sanders not still slice job-producing military-industrial complex escort Vermont;A184;O40     ;0;9
M2577   ;Even challenge dubious bailouts shield too big fail bank keep Sanders capitalistic camp reinforce industry-serving job program infrastructure project sensible trade notion;A184;O41     ;0;21
M2578   ;president be electable assail present economic system award nearly religious reverence;A184;O42     ;1;10
M2579   ;Certainly let s reinstate ’ s ardent socialism ’ ll eat progressive hat;A184;O43     ;0;12
M2580   ;Frankly ’ t find proposal smack classic socialism;A184;O44     ;0;7
M2581   ;free college education threat capitalism even profit-driven school ’ s mainly pay tab not dictate policy higher education;A184;O45     ;1;17
M2582   ;Sanders not Not only be not much socialist agenda lift capital-depleted middle-class raise wage boost consumer spend likely save today s worst-case version crony capitalism;A184;O46     ;0;24
M2583   ;fact find best example bad recent “ corporate ” socialism look further s corrupt bank bailouts s loan save;A184;O47     ;1;18
M2584   ;Years ago get re-elected call “ democratic-socialist. old time;A184;O48     ;0;8
M2585   ;craven sound bite catch phrase now dominate national political stage;A184;O49     ;1;9
M2586   ;Top-down centralize economic control;A184;O5      ;0;3
M2587   ;question “ socialism historic negative connotation be not hard-to-defend risky ploy especially win le inform unaligned moderate ley battleground state;A184;O50     ;1;19
M2588   ;Finally dread vast overheat irrational right-wing conspiracy do curse second smear value communism;A184;O51     ;0;12
M2589   ;last far far more fifteen minute infamy deserve;A184;O52     ;2;7
M2590   ;"";A184;O53     ;0;0
M2591   ;"";A184;O54     ;0;0
M2592   ;right turn nothing-burger month harangue;A184;O55     ;3;4
M2593   ;"";A184;O56     ;0;0
M2594   ;"";A184;O57     ;0;0
M2595   ;anti-immigration bigotry top early poll just imagine tremble;A184;O58     ;1;7
M2596   ;lighter note Sanders take leaf not “ democratic-capitalist ” “ compassionate American-born socialism ”;A184;O59     ;2;13
M2597   ;Widespread price control suspicion private property even sanctify Year Plans;A184;O6      ;0;9
M2598   ;not “ compassionate capitalism ” phrase ha major practical downside skeptical Sanders be more likely fall laugh stitch so long miss get vote booth;A184;O60     ;3;23
M2599   ;Quantitative People s;A184;O61     ;0;2
M2600   ;’ s vast number voter let alone political scientist think “ socialism. ” pragmatic progressive time team reconsider self-induced obstacle stun primary upset rock political foundation;A184;O7      ;1;25
M2601   ;ignite model progressive era last generation more equal first Era;A184;O8      ;2;9
M2602   ;Curiously activist mayor didn t push “ socialize city utility achieve community trust house ” fight intrusive cable price hike bad lakefront development;A184;O9      ;0;22
M2604   ;ELA morning officially start unit first learn be ancient civilization use explain phenomenon do n't understand;A186;O1      ;0;15
M2605   ;51-15 Due b 11-18 c video take note Handout due Reminders game;A186;O10     ;0;11
M2606   ;then dive right read myth creation world 's first inhabitant Titans;A186;O2      ;1;10
M2607   ;get nitty gritty detail year spend time class teach few essential skill believe benefit student rest year well High;A186;O3      ;4;18
M2608   ;Today focus give effective presentation front audience;A186;O4      ;0;6
M2609   ;Students learn everything information be slide font size/colour successfully keep audience engage;A186;O5      ;0;11
M2610   ;Students work apply skill week be task prepare own small presentation;A186;O6      ;0;10
M2611   ;Religion lunch student be give half hour period work assignment start yesterday;A186;O7      ;0;11
M2612   ;Math Students spend entire period finish textbook assignment yesterday work new handout;A186;O8      ;0;11
M2613   ;Upcoming Coat Arms due Pg;A186;O9      ;0;4
M2614   ;say migrant crisis have worsen require cooperation European nation address;A187;O1      ;6;9
M2615   ;make remark meet;A187;O2      ;1;2
M2616   ;president say hop visit end term office;A187;O3      ;1;6
M2618   ;recently hit best-seller list new book Top recently join other lead real estate expert world co-author new book Get Top;A188;O1      ;5;19
M2619   ;have be rank Top most successful real estate team s “ ha establish top agent world sell more home capture % market share;A188;O10     ;1;22
M2620   ;wa name world compete realtor –the youngest ever achieve;A188;O11     ;4;8
M2621   ;result don ’ t stop there wa rank Southern include realtor state;A188;O12     ;1;11
M2622   ;wa recognize Sales open new company Experts;A188;O13     ;1;6
M2623   ;ha also enjoy immense success top agent worldwide;A188;O14     ;1;7
M2624   ;company be regularly rank team;A188;O15     ;1;4
M2625   ;team recently break record buyer sale branch work out go independent;A188;O16     ;3;10
M2626   ;earn only third year business hasn ’ t make le;A188;O17     ;1;9
M2627   ;describe book increasingly complex financial world try make most efficient use disposable income;A188;O18     ;1;12
M2628   ;western economy typically try purchase asset frugally possible sell subsequently much open market;A188;O19     ;2;12
M2629   ;lead business book publisher release book;A188;O2      ;3;5
M2630   ;Generally speak try obtain TOP item sell;A188;O20     ;0;6
M2631   ;buy sell real estate home rank there one most important transaction ever make financially emotionally;A188;O21     ;2;14
M2632   ;u even purchase sell several residence course lifetime;A188;O22     ;2;7
M2633   ;addition many people buy sell house commodity make income-producing investment business;A188;O23     ;1;10
M2634   ;people manage transaction own most u be ill-equipped do so;A188;O24     ;2;9
M2635   ;be reason book wa write;A188;O25     ;1;4
M2636   ;guidance book likely be eye-opening wish sell purchase real estate avoid error expert encounter discuss;A188;O26     ;1;14
M2637   ;be reason not normally ask doctor represent u court law attorney perform surgery u;A188;O27     ;1;13
M2638   ;have write book discus area expertise mentor;A188;O28     ;3;6
M2639   ;have experience certification back presentation;A188;O29     ;1;4
M2640   ;day release r eached best-seller status several category reach ‘ Real Sales category ‘ category achieve best seller status ‘ Real category;A188;O3      ;2;21
M2641   ;day age be only prudent use expertise experience professional one guide maze real estate transaction order obtain property;A188;O30     ;2;17
M2642   ;successful release be recognize organization honor author many lead independent best-seller list;A188;O31     ;3;11
M2643   ;order copy portion royalty earn Top Dollar be give s not profit organization dedicate create unique launch campaign raise money awareness charitable cause;A188;O32     ;3;22
M2644   ;More start aim help success-minded agent create business lifestyle virtually real estate agent dream;A188;O33     ;0;13
M2645   ;currently serf more agent revolutionary business model innovative business system;A188;O34     ;2;9
M2646   ;co-founded offer most prestigious designation real estate agent today s market have;A188;O35     ;4;11
M2647   ;designee be ha be recognize agent highly differentiate repeatable system get seller up % more method average real estate agent;A188;O36     ;5;19
M2648   ;s goal be provide highest level education business material agent be truly serious bring absolute best consumer experience today s home seller buyer;A188;O37     ;3;22
M2649   ;designation be four-part certification process help today s real estate agent learn need truly distinguish competition establish true number choice real estate consumer marketplace;A188;O38     ;5;23
M2650   ;be best-selling author s top ten list book small business book be see other major network television show;A188;O39     ;1;17
M2651   ;contribute chapter title ‘ write Turn Top Much Will Walk Away Sell More year ago luck chance lead reunion summer afternoon;A188;O4      ;2;20
M2652   ;Currently life wife son;A188;O40     ;0;3
M2653   ;life wife son;A188;O41     ;1;2
M2654   ;Celebrity be lead business health wellness book publisher publish book think leader world;A188;O42     ;4;12
M2655   ;ha publish book alongside many biggest expert diverse field;A188;O43     ;2;8
M2656   ;ha help launch best-selling author date;A188;O44     ;1;5
M2657   ;Learn more http //www.celebritypresspublishing.com Contact 800-980-1626;A188;O45     ;0;5
M2658   ;Real estate wa discussion day young share sell home previous year receptive;A188;O5      ;0;11
M2659   ;know chance encounter turn wildly successful partnership be now Advisors;A188;O6      ;1;9
M2660   ;day team have sell more home;A188;O7      ;2;5
M2661   ;Together have bring more commission real estate business;A188;O8      ;0;7
M2662   ;have be member s prestigious ” group;A188;O9      ;4;6
M2663   ;Company Page print page crowd be expect gather get glimpse address joint session;A189;O1      ;0;12
M2664   ;addition ultra lightweight product be solid/black face technology eliminate transparency issue often find other panel;A189;O10     ;1;14
M2665   ;tile be view clearly close foot loss clarity;A189;O11     ;1;7
M2666   ;jumbo.tv be premier provider large scale video display relate service specialize state art mobile modular technology creative/content service well custom design fabrication;A189;O12     ;5;21
M2667   ;full service solution span most complex modular configuration custom build size largest fleet turnkey mobile unit;A189;O13     ;1;15
M2668   ;pride deliver More Ways Get exceptional customer service innovative design relentless pursuit perfection unpredictable event business;A189;O14     ;1;15
M2669   ;provide broadcast production support countless national event include 100th;A189;O15     ;2;8
M2670   ;be screen provider several college football program tournament;A189;O16     ;1;7
M2671   ;GoVision be base office;A189;O17     ;0;3
M2672   ;Read full story http //www.prweb.com/releases/2015/09/prweb12959715.htm;A189;O18     ;0;4
M2673   ;Page Related Keywords Source;A189;O19     ;0;3
M2792   ;path climb pair gate immediately join deeply-rutted green lane;A193;O21     ;1;8
M2674   ;have past team Texas-based ha be enlist provide giant screen need give assemble mass best possible view;A189;O2      ;3;16
M2675   ;Rights Reserved;A189;O20     ;1;1
M2676   ;GoVision be provide massive screen historic occasion;A189;O3      ;0;6
M2677   ;x unit x unit flank lawn give general public real-time view address;A189;O4      ;2;11
M2678   ;addition wall comprise ultra-lightweight panel be position step invite dignitary other attendee;A189;O5      ;1;11
M2679   ;One-day event just dont get bigger couldnt be more honor have be task incredibly important responsibility say founder know enormous undertake be broadcast live video ground especially entire world watch;A189;O6      ;0;29
M2680   ;team be up challenge be ready be part history;A189;O7      ;2;8
M2681   ;visit serve fit showcase most state-of-the-art equipment market;A189;O8      ;2;7
M2682   ;new panel weigh just pound tile offer extremely high resolution indoors;A189;O9      ;1;10
M2683   ;father sit impassively hear wa charge murder three-month-old daughter;A19 ;O1      ;2;8
M2684   ;baby believe be name die;A19 ;O10     ;1;4
M2685   ;service have be call family home about;A19 ;O11     ;1;6
M2686   ;charge have be lay boy death police have confirm homicide detective be prepare report coroner;A19 ;O12     ;1;14
M2687   ;autopsy ha be carry police have not reveal nature result;A19 ;O13     ;1;9
M2688   ;boy wa youngest sibling boy girl age;A19 ;O14     ;1;6
M2689   ;mother write grief month;A19 ;O15     ;1;3
M2690   ;pain be still raw wa yesterday;A19 ;O16     ;2;5
M2691   ;hurt be unbearable write;A19 ;O17     ;1;3
M2692   ;be leave picture clothe toy memory;A19 ;O18     ;2;5
M2693   ;never understand fully happen pure innocent soul … soul create put [ ] planet;A19 ;O19     ;2;13
M2694   ;baby wa rush local hospital suffer report cough fit home central;A19 ;O2      ;1;10
M2695   ;never be same;A19 ;O20     ;2;2
M2696   ;child leave today be reason not self destruct;A19 ;O21     ;1;7
M2697   ;high high be;A19 ;O22     ;2;2
M2698   ;love not wait hold smell kiss play again;A19 ;O23     ;1;7
M2699   ;Anyone information be request contact submit confidential crime report www.crimestoppers.com.au;A19 ;O24     ;0;9
M2700   ;wa say be deal custody management issue make brief court appearance video link;A19 ;O3      ;6;12
M2701   ;Dressed black hoodie do not apply bail spend bar next court appearance next year;A19 ;O4      ;0;13
M2702   ;die be fly critical condition;A19 ;O5      ;2;4
M2703   ;ha be report wa feed three-month-old daughter afternoon start cough then begin choke gasp air;A19 ;O6      ;1;14
M2704   ;baby mother arrive desperately try clear baby airway notice blood come mouth nose accord friend couple;A19 ;O7      ;2;15
M2705   ;baby wa rush local hospital air-ambulance fly Hospital die follow day;A19 ;O8      ;1;10
M2706   ;Meanwhile homicide detective west be still investigate suspicious death 11-month-old boy;A19 ;O9      ;0;10
M2707   ;presidential candidate celebrate birthday poke fun front-runner;A190;O1      ;8;6
M2708   ;guess best birthday present be hear have drop joke presidential forum;A190;O2      ;2;10
M2709   ;wait minute;A190;O3      ;3;1
M2710   ;wa just today say;A190;O4      ;1;3
M2711   ;Trump last minute cancel appearance conservative forum cite need close significant business transaction wa delay;A190;O5      ;0;14
M2712   ;cancellation come take fire refuse address attendee assertion be problem be campaign event;A190;O6      ;2;12
M2713   ;campaign manager tell do not hear questioner make statement only hear questioner ask terrorist train camp hear question train camp say have look campaign manager say;A190;O7      ;2;25
M2714   ;danger distract drive affect thousand life year;A191;O1      ;15;6
M2715   ;Many other activity also be distract car eat drink manage entertainment even put makeup;A191;O10     ;0;13
M2716   ;sure car be only get point point save other activity destination;A191;O11     ;1;10
M2717   ;Make family priority;A191;O12     ;0;2
M2718   ;responsibility come drive vehicle hazard accompany distract drive;A191;O13     ;2;7
M2719   ;rule whole family so teen driver know too be engage create safe zone own vehicle;A191;O14     ;1;14
M2720   ;Be good role model even child be old enough drive so witness only good habit;A191;O15     ;0;14
M2721   ;Set reminder safety;A191;O16     ;0;2
M2722   ;Place sticky note phone photo love non-obstructive location car remind commitment safe drive;A191;O17     ;0;12
M2723   ;savvy owner download app create be free allow user upload photo love;A191;O18     ;1;11
M2724   ;app then detect wearer be move vehicle bring photo psychological reminder drive safely;A191;O19     ;1;12
M2725   ;take proper step ensure safe drive experience passenger others road;A191;O2      ;2;9
M2726   ;Do n't be passive passenger;A191;O20     ;0;4
M2727   ;Spreading message safe drive doe n't stop 're passenger seat;A191;O21     ;0;9
M2728   ;'re car individual use phone ask put safety yours;A191;O22     ;2;8
M2729   ;advocate safe drive tell family friend everyone know danger distract drive;A191;O23     ;2;10
M2730   ;road start smart focus drive;A191;O24     ;1;4
M2731   ;more information stay safe road http //www.edmunds.com/car-safety/;A191;O25     ;1;6
M2732   ;other food lifestyle content be find http //www.editors.familyfeatures.com;A191;O26     ;7;7
M2733   ;Family Features be lead provider free food lifestyle content use print online publication;A191;O27     ;0;12
M2734   ;Register obligation access variety format unformatted feature accompany photo automatically update content solution;A191;O28     ;0;12
M2735   ;Image Available http //www2.marketwire.com/mw/frame_mw attachid=2889792 vrocco familyfeatures.com 1-888-824-3337 http //editors.familyfeatures.com;A191;O29     ;0;9
M2736   ;According number be too real people kill due distract drive road;A191;O3      ;0;10
M2737   ;many state have adopt law crack phone usage wheel real change start home driver pledge adopt simple safety measure ensure family member also make commitment;A191;O4      ;1;24
M2738   ;advocate safe drive everywhere car expert offer tip safe travel wheel Limit distraction;A191;O5      ;1;12
M2739   ;'s always good idea have phone case breakdown other auto emergency keep distraction sight drive;A191;O6      ;2;14
M2740   ;Turn phone silent airplane mode completely enter vehicle;A191;O7      ;0;7
M2741   ;Placing phone glove box back seat trunk even just bag also keep temptation answer call text bay focus road instead;A191;O8      ;0;19
M2742   ;Just drive;A191;O9      ;0;1
M2743   ;Includes selfie stick drone [ embed content place set host visit just get little tighter;A192;O1      ;0;14
M2744   ;stick not be allow event security heighten popularity smartphone user use wide-scale celebration;A192;O10     ;1;12
M2745   ;pointer glass bottle be also part no-no list papal gathering;A192;O11     ;1;9
M2746   ;Regulations accord report advise people not bring animal event be certify assistant animal;A192;O12     ;0;12
M2747   ;Large religious statue sign be also stay home;A192;O13     ;0;7
M2748   ;Meanwhile activist start 10-day fast support campaign climate change environment;A192;O14     ;0;9
M2749   ;say be raise awareness say position issue be tough one;A192;O15     ;1;9
M2750   ;executive director say need make change lifestyle stop be such consumer;A192;O16     ;3;10
M2751   ;have really live simply stop use so much fossil fuel move renewable energy le meat;A192;O17     ;1;14
M2752   ;Pope Francis end world hunger 'Prayer Copywriter Distributed political responsibility be live level high form charity;A192;O18     ;2;15
M2753   ;Evangelization social inequality Latin American bear witness love poor contribute more fraternal society;A192;O19     ;0;12
M2754   ;visit draw security tighten;A192;O2      ;1;3
M2755   ;More place set host visit just get little tighter;A192;O20     ;0;8
M2756   ;wa announce drone size selfie stick be add list ban item attend continue read set ambush ha stack deck invite list infamous American meet arrive;A192;O21     ;9;24
M2757   ;move intend make political statement be be perceive rude continue read Neighbors story family lose everything land argument be not go give land neighbor hell;A192;O22     ;1;24
M2758   ;Owners land neighbor controversial refuse give land government;A192;O23     ;0;7
M2759   ;be intimidate year continue read firefighter home burn grind fight different fire Watch firefighter be fight fire fireman receive word home wa consume;A192;O24     ;10;22
M2760   ;wildfire consume home firefighter wa mile away continue read threaten new video year follow terrorist attack release new video threaten new terrorist attack be way;A192;O25     ;10;24
M2761   ;10-minute video extremist group claim be back continue read story teenage refugee be give opportunity meet tragic journey ha end once-in-a-lifetime opportunity meet;A192;O26     ;10;22
M2762   ;Juan have escape home find refuge parent continue read Have hear do prepare visit;A192;O27     ;9;13
M2763   ;Watch be land just day;A192;O28     ;0;4
M2764   ;Catholics country have be prepare ground-breaking visit anticipate excitement;A192;O29     ;0;8
M2765   ;Highlights www.catholic.org minute ago Published Keywords Regulations wa announce drone size selfie stick be add list ban item attend Papal-related event;A192;O3      ;0;20
M2766   ;Pope first stop be continue read announce commitment support Syrian refugee American be ready help refugee look sanctuary leave home war-torn country;A192;O30     ;9;21
M2767   ;ha confirm commitment help;A192;O31     ;6;3
M2768   ;continue read Teen charge felony attack man teenager wa charge count felony aggravate battery hate crime attack man;A192;O32     ;10;17
M2769   ;authority describe begin road rage end hate crime continue read be burn 's get worse Watch be burn worst be yet come;A192;O33     ;10;21
M2770   ;fire crew battle massive blaze central few be already worry bring;A192;O34     ;1;10
M2771   ;Historically be season greatest fire hazard;A192;O35     ;0;5
M2772   ;continue read;A192;O36     ;5;1
M2773   ;According firearm plastic toy gun be still not allow bring large-scale religious statue toy mimic weapon;A192;O4      ;0;15
M2774   ;plan attend papal visit event leave drone home;A192;O5      ;3;7
M2775   ;fly drone designate restrict area be subject civil criminal charge say administrator;A192;O6      ;1;11
M2776   ;be host papal event have declare administration;A192;O7      ;6;6
M2777   ;Even remote-controlled model plane be not allow vicinity area;A192;O8      ;0;8
M2778   ;have yet be draft regulation regard small drone however be bud history issue concern personal privacy;A192;O9      ;1;15
M2839   ;move too—and big way;A195;O18     ;1;3
M3155   ;'s lot happen;A24 ;O9      ;2;2
M2779   ;avoid touristy knick-knackery enjoy olde worlde charm sometimes feel time capsule remnant quieter more peaceful come motorway mass tourism;A193;O1      ;7;18
M2780   ;duck pond turn side village pub towards;A193;O10     ;2;6
M2781   ;yard take sign public footpath lead cottage right;A193;O11     ;2;7
M2782   ;lead play area gap hedge opposite;A193;O12     ;1;5
M2783   ;Turn leave side field follow boundary bottom reach sink track;A193;O13     ;0;9
M2784   ;Turn leave head;A193;O14     ;0;2
M2785   ;right front follow lane onwards aim slender needle skyline;A193;O15     ;1;8
M2786   ;"";A193;O16     ;0;0
M2787   ;lane reach do not enter farmyard instead follow arrowed path leave;A193;O17     ;2;10
M2788   ;sign bridleway way round continue follow yellow arrow farm continue original line foot field reach chalk-surfaced farm track turn leave;A193;O18     ;2;19
M2789   ;briefly line tree track turn right carry straight tree pas narrow woodland press directly ahead next line tree;A193;O19     ;2;17
M2790   ;Aloof hustle bustle be often desert landscape intersperse picturesque village have grow village pond sky-tickling steeple;A193;O2      ;0;15
M2791   ;"";A193;O20     ;0;0
M2793   ;return route turn leave here be shame not visit monument so first head rightwards visit tower.It be high wa build memory fourth wa account liberal landlord standard day much-loved countryman know “ t;A193;O22     ;1;32
M2794   ;marry age father child live be;A193;O23     ;1;5
M2795   ;monument resemble earthbound rocket stone build ha be prominent landmark ever jewel estate ha be own family year;A193;O24     ;1;17
M2796   ;"";A193;O25     ;0;0
M2797   ;monument head back green lane old driver road be follow unerringly traverse side shallow valley extensive view;A193;O26     ;2;16
M2798   ;couple mile reach road;A193;O27     ;2;3
M2799   ;time be press provide short cut back;A193;O28     ;1;6
M2800   ;However cross carry green lane mile so second road;A193;O29     ;0;8
M2801   ;change slowly season spring green be splash day-glo yellow field oil seed rape high summer turn golden ripen wheat barley winter become palest brown corduroy vast field chalky soil go plough neat furrow;A193;O3      ;1;32
M2802   ;"";A193;O30     ;0;0
M2803   ;cross still follow green lane;A193;O31     ;2;4
M2804   ;right way continue yard so footpath sign leave point diagonally back crop road have just cross;A193;O32     ;1;15
M2805   ;tear grind however suggest most people have cross road simply turn leave inside hedge road arrangement avoid trample crop suit walker farmer alike;A193;O33     ;2;22
M2806   ;"";A193;O34     ;0;0
M2807   ;route lead sign gap hedge right way road signpost direct walker diagonally field towards;A193;O35     ;1;13
M2808   ;stile point way large field be cross diagonally gate farm building almost far right hand corner;A193;O36     ;1;15
M2809   ;gate lead side road;A193;O37     ;1;3
M2810   ;Go house side field other T-junction;A193;O38     ;0;5
M2811   ;Turn right get back village pond;A193;O39     ;0;5
M2812   ;be not national park designate way byway tend be empty village have be spar tweeness knick-knackery afflict so many visitor honeypot Moors;A193;O4      ;2;21
