mention_id;mention_text;doc_id;sentence_id;begin_index;end_index
M1      ;rand investment mobile advertise be grow quickly — spend be project reach bn accord yet only % ad receive type engagement;A1  ;O1      ;1;20
M2      ;be usually online audience segment consumer have have not see market campaign creative ask respond brand perception questionnaire;A1  ;O10     ;1;17
M3      ;approach only tap person s conscious brain — major shortcoming;A1  ;O11     ;1;9
M4      ;Subconscious brain activity According research only % brain ’ s activity be expend conscious activity;A1  ;O12     ;0;14
M5      ;remain brain activity be devote largely unconscious process;A1  ;O13     ;1;7
M6      ;Developing more comprehensive measurement system mobile impression require tap deeper subconscious activity;A1  ;O14     ;0;11
M7      ;Wearable device track neurological activity be readily available consumer;A1  ;O15     ;0;8
M8      ;eye-tracking number software hardware company be develop advance eye-tracking emotion-sensing tool;A1  ;O16     ;1;10
M9      ;Extending technology work front-facing camera smartphones only make sense;A1  ;O17     ;0;8
M10     ;predict s feature eye-tracking software page down be deploy advertise measurement not-too-distant future;A1  ;O18     ;1;12
M11     ;assuage understandable consumer privacy concern company develop technology require opt-in type measurement;A1  ;O19     ;1;11
M12     ;tool resource do advertiser agency have report analyse % unclicked impression;A1  ;O2      ;1;10
M13     ;cancel event ” opt-in neurological measurement eye-tracking measure signal action interest consider other engagement click;A1  ;O20     ;2;14
M14     ;Analytics company be measure mouseover time desktop platform;A1  ;O21     ;0;7
M15     ;equivalent hover time mobile be place finger screen pull actually tap;A1  ;O22     ;1;10
M16     ;action know “ cancel event ” iOS be not be track advertiser still signal intent ad interaction;A1  ;O23     ;1;16
M17     ;Improving ecosystem continue demand new measurement standard technology better understand role impression play digital ad spend;A1  ;O24     ;0;15
M18     ;publisher benefit be able c premium ad be simply see not click ” have clear prove benefit advertiser;A1  ;O25     ;1;17
M19     ;ultimately consumer always benefit more relevant interruptive more engage advertise creative design enhance experience;A1  ;O26     ;1;13
M20     ;–;A1  ;O27     ;0;0
M21     ;"";A1  ;O28     ;0;0
M22     ;ad impression have value be only flaw debatable tool measurement;A1  ;O3      ;1;9
M23     ;Impressions shouldn ’ t be waste ad not be universally discount waste impression;A1  ;O4      ;0;12
M24     ;recent mobile advertise neuroscience study show impression influence brand perception;A1  ;O5      ;1;9
M25     ;Analytics platform have focus heavily viewability make certain ad be viewable;A1  ;O6      ;0;10
M26     ;Contrary standard viewability be minimum % pixel view minimum second agency announce earlier year only count video impression % ad player be view;A1  ;O7      ;0;22
M27     ;Additional measurement technique be need help industry gauge value viewable impression especially mobile device full-screen viewable impression mean captivate audience;A1  ;O8      ;0;19
M28     ;measurement be flaw dawn commercial internet value display ad impression ha largely be measure survey;A1  ;O9      ;1;14
M29     ;Shares First American FAF have earn average broker rat score broker provide coverage stock report;A10 ;O1      ;0;14
M30     ;First American FAF last issue quarterly earn result;A10 ;O10     ;0;7
M31     ;company report quarter top consensus estimate;A10 ;O11     ;1;5
M32     ;same quarter last year firm post earn share;A10 ;O12     ;2;7
M33     ;business earn quarter compare consensus estimate;A10 ;O13     ;1;5
M34     ;First American s revenue wa up % compare same quarter last year;A10 ;O14     ;0;11
M35     ;Equities analyst anticipate First American post earn share current year;A10 ;O15     ;0;9
M36     ;business also recently disclose quarterly dividend wa pay;A10 ;O16     ;1;7
M37     ;Shareholders record be issue dividend share;A10 ;O17     ;0;5
M38     ;ex-dividend date dividend wa;A10 ;O18     ;1;3
M39     ;represent annualized dividend yield %;A10 ;O19     ;1;4
M40     ;research analyst have rat stock hold recommendation have give strong buy recommendation company;A10 ;O2      ;1;12
M41     ;other First American news sell share company ’ s stock transaction occur;A10 ;O20     ;1;11
M42     ;stock wa sell average price total transaction;A10 ;O21     ;1;6
M43     ;sale wa disclose legal file be accessible hyperlink;A10 ;O22     ;1;7
M44     ;Separately downgrade “ buy rat “ neutral ” rat report;A10 ;O23     ;0;9
M45     ;First American FAF be hold company;A10 ;O24     ;0;5
M46     ;subsidiary be engage business provide financial service;A10 ;O25     ;2;6
M47     ;operate segment Title Insurance segment segment;A10 ;O26     ;2;5
M394    ;First real man doesn t play crazy game;A115;O13     ;0;7
M48     ;segment issue title insurance policy residential commercial property;A10 ;O27     ;5;7
M49     ;segment also provide close escrow service accommodate tax-deferred exchange real estate provide bank trust investment advisory service;A10 ;O28     ;1;16
M50     ;s specialty insurance segment issue property casualty insurance policy sell home warranty product;A10 ;O29     ;3;12
M51     ;First American s rat score ha decline % month result various analyst ’ rating change;A10 ;O3      ;0;14
M52     ;property casualty insurance business provide insurance coverage residential homeowner renter liability loss typical hazard fire theft vandalism other type property damage;A10 ;O30     ;1;20
M53     ;s subsidiary be First American;A10 ;O31     ;3;4
M54     ;get free copy research report First American click here;A10 ;O32     ;1;8
M55     ;more information research offering visit;A10 ;O33     ;1;4
M56     ;Brokerages have set month consensus price target company be forecast company post current quarter accord;A10 ;O4      ;0;14
M916    ;family victim 're always thought;A13 ;O41     ;4;4
M57     ;Zacks ha also give First industry rank base rating give competitor;A10 ;O5      ;0;10
M58     ;First American FAF open;A10 ;O6      ;0;3
M59     ;stock ha market cap price-to-earnings ratio;A10 ;O7      ;1;5
M60     ;company ha 50-day move average day move average;A10 ;O8      ;1;7
M61     ;First American ha 12-month low 12-month high;A10 ;O9      ;0;6
M62     ;say bouncer cause captain concussion leave several player shake have bring memory fatal injury;A100;O1      ;2;13
M63     ;Obviously wa tough summer u back home lose close mate;A100;O10     ;0;9
M64     ;'s always nasty get blow;A100;O11     ;1;4
M65     ;add be ha be hit time helmet Australian bouncer belief have analyse technique short ball;A100;O12     ;1;14
M66     ;probably have look see 's anything technically different do say;A100;O13     ;3;9
M67     ;have n't have chat yet 'm sure 's something look go forward;A100;O14     ;2;11
M68     ;wa daze unable play further part match be strike helmet short ball seventh fifth;A100;O2      ;1;13
M69     ;go win match wicket series;A100;O3      ;1;4
M70     ;skipper wa up end match accord coach wa deem unable take part post-match ceremony;A100;O4      ;2;13
M71     ;ha get bite lump headache be anxious moment anyone get hit fact walk field wa good sign;A100;O5      ;2;16
M72     ;wa bite dizzy while take hour so come good;A100;O6      ;1;8
M73     ;monitor medical staff leave middle play match last year claim wa clearly shake;A100;O7      ;2;12
M74     ;saw fit immediately walk boundary talk admit few number be affect;A100;O8      ;2;10
M75     ;think there be couple guy be bite shake up particular;A100;O9      ;2;9
M76     ;financial crisis loom campaign appearance presidential contender sharply different position key issue for… Continue »;A101;O1      ;3;14
M77     ;click enlargesnowflock/ThinkstockGood report let reader draw own conclusion 's good thing.After read s cover story rape send note say much admire;A102;O1      ;0;20
M78     ;empathize character ’ trauma struggle allow be complicate inconsistent;A102;O10     ;1;8
M79     ;e-mail sound people argue mutual friend feel ’ ve come understand better friend understand;A102;O11     ;2;13
M80     ;journalist ’ t afford be unreliable narrator s report be meticulous;A102;O12     ;1;10
M81     ;’ s reticent;A102;O13     ;2;2
M82     ;give space;A102;O14     ;1;1
M83     ;’ literary device reader write story read;A102;O15     ;1;6
M84     ;saw device work second time week essay;A102;O16     ;1;6
M85     ;run previously;A102;O17     ;2;1
M86     ;give daughter adoption;A102;O18     ;2;2
M87     ;Then try be mom be title op-ed creative write teacher become pregnant give baby couple couldn t conceive;A102;O19     ;0;17
M88     ;follow wa exchange e-mail expose difference perspective root age sex;A102;O2      ;1;9
M89     ;’ re tell stay touch daughter s new parent read letter study picture;A102;O20     ;2;12
M90     ;daughter ten welcome visit;A102;O21     ;3;3
M91     ;visit multiply marry wa junior bridesmaid;A102;O22     ;1;5
M92     ;give birth second daughter s disposition change become sullen angry;A102;O23     ;3;9
M93     ;announce hat family tell u almost passing— mother move say felt even more alone;A102;O24     ;1;13
M94     ;actually move turn;A102;O25     ;1;2
M95     ;enroll local college table warm;A102;O26     ;1;4
M96     ;finally feel peace;A102;O27     ;1;2
M97     ;doesn t last;A102;O28     ;2;2
M98     ;drop school head north find adoptive father;A102;O29     ;1;6
M99     ;wonder wa begin think actually do n't like story much;A102;O3      ;1;9
M100    ;now admit herself know never be mom not way u hop be;A102;O30     ;1;11
M101    ;chance understand now have be lose year ago;A102;O31     ;1;7
M102    ;get learn love simultaneously let go;A102;O32     ;1;5
M103    ;Maybe s motherhood be;A102;O33     ;0;3
M104    ;way respond s piece be say ’ s blind own material;A102;O34     ;1;10
M105    ;way be say know ’ s do ’ s count reader see story say ’ s tell ghastly story hint;A102;O35     ;2;19
M106    ;Motherhood;A102;O36     ;0;0
M107    ;attentive reader be apt think;A102;O37     ;1;4
M108    ;story be n't about motherhood;A102;O38     ;1;4
M109    ;real story here glimpse crack be little girl grow mother abandon;A102;O39     ;1;10
M110    ;story greatest virtue wa do n't tell have think;A102;O4      ;2;8
M111    ;probably have be better ’ d never know birth mother exist;A102;O40     ;1;10
M112    ;understand boilerplate sentiment motherhood recite wrap piece be vapid off-point;A102;O41     ;2;9
M113    ;Maybe not want think doe;A102;O42     ;0;4
M114    ;final ironic flourish piece ingenious creative write ’ re hard top;A102;O43     ;2;10
M115    ;want think know stuff trust reader find 's there;A102;O44     ;1;8
M116    ;writer put head snort charge reader;A102;O5      ;1;5
M117    ;ambiguity get way trample;A102;O6      ;1;3
M118    ;rape invite didacticism didn t do;A102;O7      ;1;5
M119    ;Other writer love ambiguity so much refuse sully come point;A102;O8      ;0;9
M120    ;didn t do;A102;O9      ;1;2
M166    ;head police organise crime team warn drugs-mail tactic appear be become common;A106;O8      ;6;11
M167    ;increase restriction psychoactive substance ha be increase unlawful importation harmful substance say;A106;O9      ;3;11
M168    ;Business Also chart show exactly insane growth ha be past year 'Missed be just absurd think be 's go 60-year-old dad couple get unpleasant surprise way Man year;A107;O1      ;0;27
M169    ;have zero tolerance sort fraudulent activity tell statement;A107;O10     ;2;7
M276    ;also admit wa “ better ” series do not make air;A110;O39     ;1;10
M121    ;mobile application management firm announce round today lead Malaysia-based also participate investment bring total raise date just dollar be first time Apperian ha seek fund modest round back be term provision software develop in-house call private app store actually start enterprise mobile application developer back give context market back then probably weren ’ t ton enterprise customer look custom mobile application most experimental bunch endure develop enterprise app store company customer begin ask alternative launch custom apps public app store Apperian tend compete vendor wa sell company differentiate vendor allow customer deploy system explain company belief give leg customer want deploy custom apps partner consultant other non-employees likely be reluctant let company have access phone lead Asian investment company seem ordinary say company go route couple reason want favorable term valuation wouldn ’ t require board-level involvement company wouldn t disclose valuation do indicate wa up round previous investment announcement give company in-road ha very little presence right now development office be ha help build presence so far Apperian ha have only small deal ’ s be hop connect Asian firm help gain entrée market last fund round market seem have catch Apperian Today ’ s see much larger deal average deal size have double last round high end many user say include comma Walgreens company ha employee expect add 12-14 end year use fund;A103;O1      ;2;224
M122    ;Created WINSTON-SALEM — 30-year-old limousine belong late be be raffle raise money child therapeutic care;A104;O1      ;0;14
M123    ;report http //bit.ly/1Kn884r executor estate donate custom limo couple month ago;A104;O2      ;3;10
M124    ;say child service agency want convert gray car hope child;A104;O3      ;3;9
M125    ;be sell ticket;A104;O4      ;1;2
M126    ;call hope;A104;O5      ;1;1
M127    ;vehicle come chauffeur cap park pas use teach class campus;A104;O6      ;1;9
M128    ;celebrate writer civil right activist die last year home age;A104;O7      ;1;9
M129    ;___ Information Winston-Salem http //www.journalnow.com;A104;O8      ;0;4
M130    ;sky be restful Warnings musing mention vigorous exercise substitute swear word “ have give swear autumn take run til least early;A105;O1      ;1;20
M131    ;’ d also become involve local cause politics charity well give money quite literally blood;A105;O10     ;1;14
M132    ;Which bring latest charitable venture See;A105;O11     ;0;5
M133    ;So far shoe several pair sock be only kit ’ ve purchase fund raiser ’ m run “ race;A105;O12     ;0;18
M134    ;do have other bite kit have be wear whilst train t-shirt give charity ’ ll be raise fund;A105;O13     ;1;17
M135    ;other charity be also mental health be specifically round project aim help people adopt home town;A105;O14     ;1;15
M136    ;whilst ’ ll always be American tick Other box form – consider be not only British law choice heart;A105;O15     ;2;18
M137    ;part wa allow make choice;A105;O16     ;3;4
M138    ;wa be white speak be not directly least perceive belong “ scary category immigrant;A105;O17     ;1;13
M139    ;Next time someone ask “ don ’ t such-and-such – fill blank ethnic and/or religious group choice – assimilate ” – ask yourselves be honestly give people real choice join;A105;O18     ;0;29
M140    ;Swans still water Doncaster blog be subtitle “ Musings British ” ’ s tin Spring be half-Romanian dad s side;A105;O19     ;0;19
M141    ;remain see prof more chuffin ’ difficult;A105;O2      ;1;6
M142    ;’ ve probably whinged – undoubtedly shut world end again – fact new immigrant do not receive handbook arrival;A105;O3      ;1;18
M143    ;do test cover such useful subject food old telly show swear;A105;O4      ;1;10
M144    ;“ do include section sport wa comparatively brief compare such useful bit information percentage population be ethnic minority According husband ’ s help study real answer be ’ re ” citizenship exam be probably mind Polish lady know ha just sit exam be sit “ exam next;A105;O5      ;0;46
M145    ;subject immigration like be also news judge own life heat topic conversation;A105;O6      ;1;11
M146    ;’ s also nearly year officially become British subject;A105;O7      ;1;8
M147    ;say “ officially ” practically emotionally already think Anglo-American;A105;O8      ;1;8
M148    ;practical level have work pay tax include – do best follow law rule put bin correct day;A105;O9      ;2;16
M149    ;crystal form be know street bath salt flakka;A106;O1      ;2;7
M150    ;People engage such activity not hide apparent anonymity internet face real risk criminal conviction possible imprisonment import substance;A106;O10     ;1;17
M151    ;investigation manager say border security detection system be excellent aim keep drug country;A106;O11     ;4;12
M152    ;haul include bath salt – white pink crystal compose;A106;O12     ;1;8
M153    ;come crystal form tab capsule;A106;O13     ;1;4
M154    ;drug be also know street flakka niff;A106;O14     ;1;6
M155    ;According produce state excite delirium similar cocaine high characterise hyper-stimulation paranoia hallucination lead violent aggression injury;A106;O15     ;0;15
M156    ;Bath salt have be link aggressive behaviour even death overseas;A106;O16     ;1;9
M157    ;ski speed boat house more be impound bust target Chinese import drug earlier year;A106;O17     ;1;13
M158    ;men woman age face charge import;A106;O18     ;1;5
M159    ;Police say be continue investigate import;A106;O19     ;0;5
M160    ;elicit delirium hallucinogenic high;A106;O2      ;1;3
M161    ;bath salt be seize different drug bust earlier year;A106;O3      ;2;8
M162    ;police be warn psychoactive substance ban ha result more illicit drug be order online mail shore series synthetic cannabis bust border;A106;O4      ;1;20
M449    ;be run;A117;O4      ;1;1
M163    ;people be arrest charge drug importation possession cultivation supply series search warrant area last week police say;A106;O5      ;1;16
M164    ;police Customs have intercept drug border include drug methamphetamine synthetic cannabinoid also know bath salt – part investigation announce morning;A106;O6      ;1;19
M165    ;recent month investigation have result seizure dozen small package bind address;A106;O7      ;1;10
M917    ;"";A13 ;O42     ;0;0
M170    ;tell Guardian couple do n't use on-site message tool reach housesitter wa harder investigate complaint delete profile;A107;O11     ;1;16
M171    ;couple part say next time just recruit friend look apartment;A107;O12     ;1;9
M172    ;From firework joust tech exec have weird awesome hobby be secret US government airline fly commercial airport enable watch video;A107;O13     ;3;19
M173    ;be way annual art festival desert receive email friend thank couple rent apartment Guardian report;A107;O2      ;2;14
M174    ;couple have n't actually put apartment home-sharing site;A107;O3      ;2;7
M175    ;Instead have hire professional housesitter find site have then list apartment — price day;A107;O4      ;0;13
M176    ;feel violate pretty upset somebody think trust ha do apartment owner tell;A107;O5      ;2;11
M177    ;tell friend wa 'misunderstanding u s way tell go ahead make;A107;O6      ;2;10
M178    ;TrustedHousesitters remove offend entrepreneurial;A107;O7      ;0;3
M179    ;housesitter profile site ban person profile well;A107;O8      ;0;6
M180    ;couple be also pursue civil lawsuit housesitter;A107;O9      ;1;6
M181    ;Growing small-town share prepubescent girl everywhere prince arrive come pickup truck not white horse rather charm wa criminally abusive /24-7PressRelease/ little-girl dream love be shatter shark sheep clothe escape;A108;O1      ;0;28
M182    ;host program affiliate interview experience ha learn be continue forge relationship Safe speak violence woman;A108;O10     ;7;14
M183    ;http //wfae.org/post/abuse-and-recovery-love-me-madly-memoir;A108;O11     ;1;1
M184    ;wa join Licensed co-creator www.turnaroundanxiety.com;A108;O12     ;1;4
M185    ;story inspire Love ha also be feature http //www.charlotteobserver.com/entertainment/books/reading-matters- http //thecharlotteweekly.com/arts_entertainment/2015/07/south-charlo es-memoir/ http //issuu.com/tcwmagazine/docs/tcw_aug_sept_2015/10 e=5554085/14448382;A108;O13     ;1;14
M186    ;ha more year experience reporter writer editor radio television newspaper magazine master degree broadcast journalism;A108;O14     ;1;14
M187    ;work ha be publish local national publication include;A108;O15     ;1;7
M188    ;ha help launch magazine currently life;A108;O16     ;1;5
M189    ;Love be available http //www.amazon.com/Love-Me-Madly-Resa-Goldberg/dp/193732771X/ref=s e+Me+Madly http //www.barnesandnoble.com/w/love-me-madly-a-memoir-resa-goldberg/ be also available motivational speak engagement university civic group;A108;O17     ;0;16
M190    ;visit www.resagoldberg.com contact information;A108;O18     ;1;3
M191    ;Press release service press release distribution provide http //www.24-7pressrelease.com;A108;O19     ;2;8
M192    ;ever really get away terror learn trust again;A108;O2      ;2;7
M193    ;provocative time painful new memoir publish;A108;O3      ;3;5
M194    ;www.moonshinecovepublishing.com introduce starry-eyed teenybopper innocence be crush series horrify sexual physical assault span year high school;A108;O4      ;1;15
M195    ;book chronicle journey harrow trauma divorce mom shoal date;A108;O5      ;1;8
M196    ;considerable evidence contrary never abandon abide belief not only doe;A108;O6      ;4;9
M197    ;Right exist 's right corner -hidden somewhere boy men;A108;O7      ;0;8
M198    ;payoff end provide author understand past ha make such bad choice way forward happier future finally mission help girl woman have suffer similar experience;A108;O8      ;1;23
M199    ;official book launch www.resagoldberg.com donate portion book sale organize raffle Safe organization assist victim sexual assault teen pregnancy domestic violence;A108;O9      ;3;19
M200    ;caption id= attachment_20527 align= alignleft width= ] people neighbor city come celebrate equality past form parade marriage ceremony musical performance;A109;O1      ;5;19
M201    ;see come together- ’ s so beautiful;A109;O10     ;1;6
M202    ;be word describe amaze is. ” year be especially important history history new federal gay marriage legislation say;A109;O11     ;1;17
M203    ;come together even incorporate same-sex marriage ceremony festivity;A109;O12     ;7;7
M204    ;“ think year ha be amaze year nation;A109;O13     ;0;7
M205    ;mean ’ ve have miraculous event happen last couple month pride month;A109;O14     ;1;11
M206    ;um wa tell girl ’ ve be go lot pride state see so much everywhere be such beautiful thing see everyone come together finally accept truly be ’ ve always celebrated. ” begin woman begin process more year ago start try organize gay-night local bar call;A109;O15     ;1;45
M207    ;event wa hit community local bar be consistently hold event;A109;O16     ;1;9
M208    ;Luckily last year problem wa solve first gay bar;A109;O17     ;0;8
M209    ;Now hold drag show host last saturday month;A109;O18     ;0;7
M210    ;native say event be even draw member outside city;A109;O19     ;5;8
M211    ;festival double attendance year;A109;O2      ;1;3
M212    ;“ Being college town ’ ve always have people guess people support people don ’ t;A109;O20     ;0;15
M213    ;think last year ’ ve see more voice come join together be more unite;A109;O21     ;1;13
M214    ;think welcome bigger city area be college town;A109;O22     ;1;7
M3223   ;romantic;A29 ;O6      ;1;0
M215    ;’ s just wonderful get here see something ’ re familiar be also happen here;A109;O23     ;1;14
M216    ;be event everyone everywhere ’ s really good see that. queen perform show think annual event be something be proud say be more progressive s neighbor;A109;O24     ;2;25
M217    ;“ person grow doesn ’ t have type gay community ’ s kind amaze see;A109;O25     ;0;14
M218    ;don ’ t know know downtown s sign say “ Marriage be man woman ” wa only couple month ago;A109;O26     ;1;19
M219    ;Seeing kind irk bone know i ’ m there see something so close total opposite make so happy;A109;O27     ;0;17
M220    ;feel good be accept especially place live grow;A109;O28     ;1;7
M274    ;“ wa interest expand character expand life imagine be hours. ” film pilot disagree certain aspect premier TV movie instead;A110;O37     ;0;19
M1044   ;debris shell hit house car lorry be big;A134;O7      ;2;7
M221    ;don ’ t wan look back ’ re think live there… want be proud be proud step game. ” be great opportunity meet like-minded people festival environment community ally be welcome get involve next year event see lady action hold;A109;O29     ;1;39
M222    ;main event take place drag show wa host;A109;O3      ;3;7
M223    ;lady perform “ lip-synch dance performance;A109;O4      ;1;5
M224    ;native say ’ s be long process get city point acceptance;A109;O5      ;2;10
M225    ;“ Growing here never imagine happen;A109;O6      ;0;5
M226    ;never imagine be perform hometown;A109;O7      ;1;4
M227    ;mean know want think have go place do;A109;O8      ;1;7
M228    ;So have leave that- come back have girls… ’ s family really;A109;O9      ;0;11
M229    ;WASHINGTON offer assurance nuclear deal leave “ more effective ” military option become necessary;A11 ;O1      ;0;13
M230    ;have smaller more concentrate civil nuclear programme deal s verification provision give u more information plan. ” earn enough back week make sure deal be not block lawmaker;A11 ;O10     ;2;27
M231    ;agreement ease Western sanction return curtail nuclear programme;A11 ;O11     ;1;7
M232    ;Read big power clinch landmark nuclear deal Many however believe republic still seek cheat way develop atomic bomb;A11 ;O12     ;0;17
M233    ;public relation battle wa launch agreement be be put vote next week;A11 ;O13     ;1;11
