mention_id;mention_text;doc_id;sentence_id;begin_index;end_index
M4062   ;Xi say proportion verify report ha increase steadily one take exception;A61 ;O17     ;0;10
M4063   ;anyone be find be dishonest be punish accordingly;A61 ;O18     ;1;7
M4064   ;once say fight corruption never end;A61 ;O19     ;2;5
M4065   ;Cracking corruption be country do what people wish see;A61 ;O2      ;1;8
M4066   ;zero tolerance corruption never change;A61 ;O20     ;1;4
M4067   ;determination courage severity punish order rid corruption;A61 ;O21     ;3;6
M4068   ;act corruption be deal Xi say;A61 ;O22     ;1;5
M4069   ;Anti-corruption effort not hurt economy;A61 ;O23     ;0;4
M4070   ;contrary fight corruption include such malpractice rent-seeking help build clean government remove hurdle impede market operation fair rule bring better investment business environment say;A61 ;O24     ;2;23
M4071   ;ultimate purpose be serve people wholeheartedly Xi say interview ahead visit;A61 ;O3      ;1;10
M4072   ;leave afternoon state visit invitation;A61 ;O4      ;1;4
M4073   ;owe govern status support people maintain flesh-and-blood tie people Xi say;A61 ;O5      ;3;10
M4074   ;doe not operate vacuum ha unavoidably find problem kind say add corruption be just persistent;A61 ;O6      ;2;14
M4075   ;be courageous enough face problem go out correct self-purification self-rectification say;A61 ;O7      ;3;10
M4076   ;people hate corruption more anything else act allay concern;A61 ;O8      ;2;8
M4078   ;/PRNewswire/ fastest grow emerge cybersecurity technology announce today name recent Sales;A62 ;O1      ;9;10
M4079   ;Trainers undergo rigorous administer certification prior teach class;A62 ;O10     ;0;7
M4080   ;Cloud be few teach authorize course say;A62 ;O11     ;1;6
M4081   ;outstanding delivery high customer satisfaction rating be please present award;A62 ;O12     ;3;9
M4082   ;student come train program represent extensive base cybersecurity specialist hands-on knowledge next-gen solution be need protect digital economy say;A62 ;O13     ;2;18
M4083   ;award validate focus education part overall strategy;A62 ;O14     ;2;6
M4084   ;plan double solution train broader ecosystem partner;A62 ;O15     ;1;6
M4085   ;fuel channel innovative model;A62 ;O16     ;6;3
M4086   ;Working lead technology provider others provide awareness technical proficiency service support more reseller partner need create opportunity close deal secure repeat business;A62 ;O17     ;0;21
M4087   ;train more engineer annually;A62 ;O18     ;2;3
M4088   ;large distribution channel company provide resellers access arsenal business application streamline sale reduce cost accelerate adoption next-generation solutions.To learn more world-class train disruptive engagement methodology differentiate service application ha make Cloud distributor choice resellers technology company everywhere please visit www.cloudharmonics.com;A62 ;O19     ;2;39
M4089   ;high quality technical train build cybersecurity expertise next-generation technology be require address today modern threat;A62 ;O2      ;3;14
M4090   ;http //photos.prnewswire.com/prnh/20150911/265871LOGO view original version visit http //www.prnewswire.com/news-releases/cloud-harmonics-awarded-palo-alto-networks-2015-americas-excellence-in-training-partner-300141850.html;A62 ;O20     ;2;7
M4091   ;Reserved Source;A62 ;O21     ;2;1
M4092   ;Rights Reserved;A62 ;O22     ;1;1
M4093   ;Last year train more student focus help close cybersecurity skill gap accord recent survey ha leave organization unable fill open position effectively handle complex threat;A62 ;O3      ;0;24
M4094   ;be fastest grow next-generation distributor service more partner security next-gen infrastructure product service industry leader more;A62 ;O4      ;2;15
M4095   ;unique methodology be design partner sale cycle fuel quick ascension accelerate adoption next-gen solution;A62 ;O5      ;3;13
M4096   ;Core success be train deliver proprietary purpose-built virtual instructor-led train platform;A62 ;O6      ;0;10
M4097   ;platform be architected provide best train experience industry scale meet high demand train cybersecurity system engineer annually sacrifice quality evidence % overall student satisfaction rat;A62 ;O7      ;1;24
M4098   ;next-generation security platform be lead new era cybersecurity;A62 ;O8      ;2;7
M4099   ;Training provide public open-enrollment class courseware;A62 ;O9      ;1;5
M4100   ;Senator military resolve conflict not make take floor outline support administration nuclear deal critic back;A63 ;O1      ;0;14
M4101   ;Sanders remark come hour deliver forceful yet cautious back nuclear deal speech say help protect pledge elect strengthen security bond Jewish state;A63 ;O10     ;0;21
M4102   ;be currently debate resolution disapprove administration agreement;A63 ;O11     ;2;6
M4103   ;Democratic member have come favor deal give enough vote prevent likely GOP-led resolution disapprove deal;A63 ;O12     ;1;14
M4104   ;be firm belief test great nation most powerful military earth be not many war engage use strength capability resolve international conflict peaceful way Sanders say;A63 ;O13     ;2;24
M4105   ;believe be incumbent u give negotiate agreement chance succeed;A63 ;O14     ;2;8
M4106   ;vote authorize war ha nag political career year most notably bid president then-Sen. publicly oppose war cite support claim wa better suit lead foreign policy;A63 ;O15     ;2;24
M4107   ;ha say vote wa mistake;A63 ;O16     ;1;4
M4108   ;do so draw sharp contrast earlier make own case support deal;A63 ;O2      ;1;10
M4109   ;have speak agreement include many chamber have make effort thwart diplomatic process be many same people speak forcefully irresponsibly need go war worst foreign policy blunder modern history country Sanders say;A63 ;O3      ;3;30
M4110   ;Sanders do not mention vote war ha frequently cite early opposition bill authorize military force other Democratic candidate use issue highlight difference;A63 ;O4      ;0;21
M4111   ;speech characterize war-mongering;A63 ;O5      ;2;2
M4112   ;fear many colleague do n't fully understand war be last resort not first resort;A63 ;O6      ;2;13
M4113   ;be easy go war;A63 ;O7      ;1;3
M4114   ;be not so easy fully comprehend unintended consequence war Sanders say;A63 ;O8      ;1;10
M4115   ;military option always be table be last option;A63 ;O9      ;4;7
M4116   ;Lawyers firebrand preacher brand satanic heathen hope have prosecution throw court;A64 ;O1      ;0;10
M4117   ;have be inundate score potential witness wish give evidence behalf;A64 ;O10     ;2;9
M4118   ;broadcast radio television be also be seek defence team;A64 ;O11     ;1;8
M4119   ;add have correspond legal team;A64 ;O12     ;2;4
M4120   ;wa tell proceed case last day;A64 ;O13     ;4;5
M4121   ;Granting request four-week adjournment allow review case judge say be keen get case move soon possible;A64 ;O14     ;0;15
M4122   ;wa dress dark suit white shirt purple tie do not enter dock;A64 ;O15     ;3;11
M4123   ;Instead sit public gallery wife support friend other family member;A64 ;O16     ;0;9
M4124   ;Afterwards cheer applause hymn sing tell supporter have fill court corridor believe prosecution be hot potato;A64 ;O17     ;0;15
M4125   ;do n't know handle;A64 ;O18     ;2;3
M4126   ;be miserable;A64 ;O19     ;2;1
M4127   ;defence solicitor say be still await disclosure key document include police officer notebook;A64 ;O2      ;1;12
M4128   ;be look forward testify give chance;A64 ;O20     ;2;5
M4129   ;try put prison be free preach gospel;A64 ;O21     ;3;6
M4130   ;leave build sing;A64 ;O22     ;3;2
M4301   ;explain;A66 ;O24     ;1;0
M4131   ;stand back court proceeding;A64 ;O23     ;6;3
M4132   ;supporter be join;A64 ;O24     ;4;2
M4133   ;large crowd be carry banner placard read support law be not welcome country cheer sing hymn;A64 ;O25     ;1;15
M4134   ;embrace shake hand supporter say stand firm gospel;A64 ;O26     ;1;7
M4135   ;not relent inch;A64 ;O27     ;2;2
M4136   ;also say have be hearten level support;A64 ;O28     ;1;6
M4137   ;be important not only be important minister gospel denomination freedom speech freedom worship;A64 ;O29     ;2;12
M4138   ;appear be charge controversial sermon tell have not lose sight possible abuse process application;A64 ;O3      ;5;13
M4139   ;be believe test case;A64 ;O30     ;2;3
M4140   ;case ha be adjourn;A64 ;O31     ;1;3
M4141   ;c;A64 ;O32     ;2;0
M4142   ;be still await notebook entry Constable;A64 ;O4      ;2;5
M4143   ;Seventy-eight-year-old be charge connection controversial sermon make last;A64 ;O5      ;0;7
M4144   ;be be prosecute face charge improper use public electronic communication network cause grossly offensive message be send mean public electronic communication network remark make pulpit north be stream online;A64 ;O6      ;1;28
M4145   ;Hundreds Christian supporter attend brief hear have be accommodate largest court room;A64 ;O7      ;0;11
M4146   ;Solicitor reveal defence team wa wad volume material volunteer have spring pastor defence;A64 ;O8      ;0;12
M4147   ;say case be contest;A64 ;O9      ;1;3
M4148   ;Research Analysts ’ update eps estimate AAC have outperform rat reiterate analyst;A65 ;O1      ;0;11
M4149   ;Also invest primarily investment grade company % rat investment grade oppose investment primarily below investment grade company;A65 ;O10     ;0;16
M4150   ;Meanwhile increase product cost weigh gross margin;A65 ;O100    ;0;6
M4151   ;However be encourage series disappoint quarterly operate margin number company ha be turnaround regard last quarter;A65 ;O101    ;0;15
M4152   ;be mainly owe company s ongoing cost reduction initiative;A65 ;O102    ;1;8
M4153   ;flip side however lesser advertise raise concern;A65 ;O103    ;2;6
M4154   ;company be currently try implement several strategy revive top line include focus advertise efficiency improve new order sales. PIR have neutral rat reissue analyst;A65 ;O104    ;1;23
M4155   ;firm currently ha price target stock;A65 ;O105    ;1;5
M4156   ;wa downgrade analyst hold rat sell rat;A65 ;O106    ;6;6
M4157   ;According ha be negatively affect seasonality especially last report quarter;A65 ;O107    ;0;9
M4158   ;rainfall severe flood demand region;A65 ;O108    ;1;4
M4159   ;weather also delay pool opening;A65 ;O109    ;1;4
M4160   ;non-BDC status permit maintain industry concentration community regional bank;A65 ;O11     ;1;8
M4161   ;Also new pool construction remain well pre-recession level be concern;A65 ;O110    ;0;9
M4162   ;Further currency headwind weigh international sale;A65 ;O111    ;0;5
M4163   ;However company s base business sale growth favorable trend house market make headwind extent;A65 ;O112    ;0;13
M4164   ;continue strong growth pool renovation category reasonable sale growth green segment segment be positive. PWX have buy rat reaffirm analyst;A65 ;O113    ;1;19
M4165   ;firm currently ha price target stock;A65 ;O114    ;1;5
M4166   ;QSR have sector outperform rat reissue analyst;A65 ;O115    ;6;6
M4167   ;firm currently ha price target stock;A65 ;O116    ;1;5
M4168   ;RATE have outperform rat reaffirm analyst;A65 ;O117    ;4;5
M4169   ;currently have price target stock;A65 ;O118    ;1;4
M4170   ;have buy rat reaffirm analyst;A65 ;O119    ;7;4
M4171   ;believe community bank be attractive investment regulation continue drive sector bank continue require capital s deal flow pertain sector remain robust;A65 ;O12     ;1;20
M4172   ;RTL have neutral rat reissue analyst;A65 ;O120    ;5;5
M4173   ;SEI Investments wa upgrade analyst sell rat hold rat;A65 ;O121    ;0;8
M4174   ;According second-quarter earn come line;A65 ;O122    ;0;4
M4175   ;Steady growth revenue wa offset higher expense;A65 ;O123    ;0;6
M4176   ;Further asset position continue be robust;A65 ;O124    ;0;5
M4177   ;believe company s innovative diverse global investment product service keep earn momentum alive go forward;A65 ;O125    ;1;14
M4178   ;Also sturdy asset inflow continue support top-line growth;A65 ;O126    ;0;7
M4179   ;company s steady capital deployment activity remain impressive remain apprehensive regard impact weak cost control high dependence fee-based revenue stringent regulatory landscape profitability near term. have neutral rat reiterate analyst;A65 ;O127    ;2;29
M4180   ;SYIEF have buy rat reissue analyst;A65 ;O128    ;5;5
M4463   ;big-screen adaptation young child open cinema nationwide;A70 ;O32     ;1;6
M4181   ;TATYY have neutral rat reiterate analyst VFC wa downgrade analyst buy rat hold rat;A65 ;O129    ;7;13
M4182   ;company ha have loss impairment asset inception;A65 ;O13     ;1;6
M4183   ;According;A65 ;O130    ;0;0
M4184   ;report impressive second-quarter result top bottom line fare better expectation;A65 ;O131    ;1;9
M4185   ;Strong result be back solid performance business segment well lower tax rate;A65 ;O132    ;0;11
M4186   ;Also company raise earn outlook anticipate strong second half;A65 ;O133    ;0;8
M4187   ;company s sustain focus opportunistic acquisition expansion global operation highlight growth prospect;A65 ;O134    ;1;11
M4188   ;Moreover solid brand portfolio opportunity regard distribution bode well;A65 ;O135    ;0;8
M4189   ;However significant global presence expose currency headwind;A65 ;O136    ;0;6
M4190   ;prevalent soft macroeconomic environment stiff competition seasonality business also remain challenge ”;A65 ;O137    ;1;11
M4191   ;be also seek invest pool bank transaction be fund non-recourse finance permit higher leverage otherwise be structure;A65 ;O14     ;1;16
M4192   ;believe be position continue improve effective yield net investment margin;A65 ;O15     ;1;9
M4193   ;also think continue see sizable deal flow be relatively immune slowdown traditional middle market origination;A65 ;O16     ;1;14
M4194   ;price target imply estimate dividend yield %;A65 ;O17     ;3;6
M4195   ;doe not really have publicly trade comp set;A65 ;O18     ;1;7
M4196   ;be certainly other non-BDC be none knowledge invest exclusively community banks. have neutral rat reissue analyst;A65 ;O19     ;2;15
M4197   ;analyst write Demonstrates Continued announce intention acquire deal value roughly;A65 ;O2      ;1;9
M4198   ;CAG wa upgrade analyst hold rat buy rat;A65 ;O20     ;5;7
M4199   ;firm currently ha price target stock;A65 ;O21     ;1;5
M4200   ;According fiscal aim improve profitability help major strategic initiative reduction sell general administrative expense expansion well business capital investment portfolio improvement balance capital allocation;A65 ;O22     ;0;23
M4201   ;company belief acquisition serve improve top-line result upcoming quarter tap grow demand freeze food;A65 ;O23     ;1;13
M4202   ;Moreover back lucrative dividend share repurchase program aim augment value shareholder;A65 ;O24     ;0;10
M4203   ;However appreciation dollar extensive industry rivalry well volatility input supply pose challenge company go forward. wa upgrade analyst sell rat hold rat;A65 ;O25     ;0;21
M4204   ;According second-quarter earn surpass;A65 ;O26     ;0;3
M4205   ;Improvement revenue reduction provision be partly offset elevate cost;A65 ;O27     ;0;8
M4206   ;believe robust capital base sturdy liquidity level make company well position capitalize penchant inorganic growth;A65 ;O28     ;1;14
M4207   ;Also company s initiative mortgage bank area be expect pay form enhance fee generation go forward;A65 ;O29     ;0;15
M4208   ;follow late-2014 purchase highlight continue interest substance abuse treatment space industry s largest behavioral healthcare provider believe show positive macro trend industry;A65 ;O3      ;1;21
M4209   ;Further company s steady capital deployment activity continue boost shareholder value;A65 ;O30     ;0;10
M4210   ;However remain apprehensive regard impact weak expense management stringent regulation prevail low interest rate environment profitability near-term. CCL have market perform rat reissue analyst;A65 ;O31     ;0;23
M4211   ;have outperform rat reaffirm analyst;A65 ;O32     ;7;4
M4212   ;currently have target price stock;A65 ;O33     ;1;4
M4213   ;Colgate-Palmolive CL wa upgrade analyst sell rat hold rat;A65 ;O34     ;0;8
M4214   ;According “ Colgate-Palmolive command market-leading position oral care personal care product category;A65 ;O35     ;0;11
M4215   ;believe s continue focus product innovation globally recognize brand presence develop emerge economy enable capture growth opportunity boost profitability;A65 ;O36     ;1;18
M4216   ;Also capital allocation strategy enable constantly reward shareholder;A65 ;O37     ;0;7
M4217   ;However company report dismal second-quarter result top bottom line decline year year lag estimate due impact adverse foreign currency fluctuation;A65 ;O38     ;0;19
M4218   ;Also estimate move lower company expect currency headwind macroeconomic woe linger turn hurt results. ” wa upgrade analyst hold rat buy rat;A65 ;O39     ;0;21
M4219   ;Foundations wa found American therefore believe organization similar service target somewhat similar customer base direct-to-consumer market platform national sale team ha relatively similar sale mix have hold rat reissue analyst;A65 ;O4      ;0;29
M4220   ;currently have target price stock;A65 ;O40     ;1;4
M4221   ;According post narrower-than-expected loss share first quarter fiscal;A65 ;O41     ;0;7
M4222   ;However loss widen year-ago period;A65 ;O42     ;0;4
M4223   ;other hand net sale fell short rise % year year back strong performance brand offset softness witness brand;A65 ;O43     ;2;17
M4224   ;Sales trend remain sturdy division initiative boost consumer experience;A65 ;O44     ;0;8
M4225   ;Management now project top- bottom-line growth % % respectively fiscal ” DVA have outperform rat reaffirm analyst;A65 ;O45     ;0;16
M4226   ;have outperform rat reiterate analyst;A65 ;O46     ;6;4
M4227   ;EMC wa downgrade analyst hold rat sell rat;A65 ;O47     ;4;7
M4228   ;According report mix second quarter result earn surpass revenue miss same;A65 ;O48     ;0;10
M4229   ;believe modest performance wa due significant competition storage compute market sluggish spend price pressure continue pressure stock;A65 ;O49     ;1;16
M4230   ;currently ha target price stock;A65 ;O5      ;5;4
M4231   ;Nevertheless company s long-term growth remain support customer win strong backlog high-end product launch;A65 ;O50     ;0;13
M4232   ;s strategic acquisition partnership product breadth focus third generation platform predictive analytics mobile compute help enterprise move cloud thus drive top line. GOLD have neutral rat reissue analyst;A65 ;O51     ;2;27
M4235   ;Shares have trade % % last day follow presentation management competitor ’ s conference. IBN wa upgrade analyst sell rat hold rat;A65 ;O54     ;0;21
M4236   ;According s first-quarter fiscal end result primarily benefit growth revenue partially offset elevate operate expense higher loan loss provision;A65 ;O55     ;0;18
M4237   ;believe company s increase dependence domestic loan focus improve fee income stable fund base market leadership insurance business keep enhance growth;A65 ;O56     ;1;20
M4238   ;However highly competitive operate environment expense persistent deterioration credit quality stringent regulatory requirement continue dampen company s performance. wa upgrade analyst sell rat hold rat;A65 ;O57     ;0;24
M4239   ;According s third-quarter fiscal result show improvement term revenue earn drive strong seasonality demand pattern;A65 ;O58     ;0;14
M4240   ;company witness robust performance segment couple considerable benefit acquisition drive earn quarter;A65 ;O59     ;1;11
M4241   ;initiate coverage share;A65 ;O6      ;2;2
M4242   ;However cyclical nature semi-conductor industry prolong time-cycle test product likely act headwind;A65 ;O60     ;0;11
M4623   ;Now;A74 ;O56     ;0;0
M4243   ;Moreover company operate highly competitive environment;A65 ;O61     ;0;5
M4244   ;result be force reduce price increase spend impact sale profit adversely;A65 ;O62     ;2;10
M4245   ;Also frequent introduction product difficulty integration acquire company weigh s near-term results. JCI have strong-buy rat reaffirm analyst;A65 ;O63     ;0;17
M4246   ;currently ha target price stock;A65 ;O64     ;5;4
M4247   ;wa downgrade analyst hold rat sell rat;A65 ;O65     ;9;6
M4248   ;According report first-quarter fiscal earn share outdo expectation revenue fell short;A65 ;O66     ;0;10
M4249   ;However constant currency basis metric be year year drive growth Author-Funded;A65 ;O67     ;0;10
M4250   ;Given gradual decline print medium company be transform business more digital service orient;A65 ;O68     ;0;12
M4251   ;Revenue book decline % quarter market same be expect remain pressure;A65 ;O69     ;0;10
M4252   ;firm issue neutral rat target price stock;A65 ;O7      ;1;6
M4253   ;Moreover due global operation company s revenue be vulnerable currency fluctuations. ” MDP wa upgrade analyst sell rat hold rat;A65 ;O70     ;0;19
M4254   ;According advertise trend digital section recent acquisition continue favorably impact s performance;A65 ;O71     ;0;11
M4255   ;be evident company s fourth-quarter fiscal result earn share grow % year year beat seventh straight quarter;A65 ;O72     ;1;16
M4256   ;revenue come almost line estimate grow % year year;A65 ;O73     ;1;8
M4257   ;Waning print medium trend stiff competition continue be immediate concern;A65 ;O74     ;0;9
M4258   ;Nevertheless be focus bolster advertise revenue primarily digital space be increasingly concentrate brand license market service e-Commerce;A65 ;O75     ;0;16
M4259   ;Recently ha announce decision acquire wa upgrade analyst sell rat hold rat;A65 ;O76     ;0;11
M4260   ;According be broad range high-reliability analog/mixed signal integrate circuit;A65 ;O77     ;0;8
M4261   ;Fiscal third-quarter earn beat couple cent;A65 ;O78     ;0;5
M4262   ;Also forward revenue guidance wa encourage;A65 ;O79     ;0;5
M4263   ;analyst write be initiate coverage rat price target;A65 ;O8      ;1;7
M4264   ;s compel product scope margin expansion decent balance sheet be other positive;A65 ;O80     ;2;11
M4265   ;However pocket weakness relate high-margin satellite business product transition medical customer push-out communication spend softer oil gas market impact revenue;A65 ;O81     ;0;19
M4266   ;Also heavy investment impact near-term profitability. MTG wa downgrade analyst strong-buy rat hold rat;A65 ;O82     ;0;13
M4267   ;According s improve house market outstanding credit quality new business continue spur growth;A65 ;O83     ;0;12
M4268   ;annual persistency be expect % %;A65 ;O84     ;4;5
M4269   ;However lower annual premium stricter capital regulation persistently low interest rate be headwind;A65 ;O85     ;0;12
M4270   ;Nonetheless company expect comply revise be likely be effective year-end;A65 ;O86     ;0;9
M4271   ;respect earn result company s second-quarter net income share beat more double year year rise new insurance write lower loss;A65 ;O87     ;1;19
M4272   ;premium decrease new delinquent notice pay claim delinquent inventory result upside. ” NKE wa downgrade analyst buy rat hold rat;A65 ;O88     ;2;19
M4273   ;According post splendid fourth-quarter fiscal earn sale result enhance margin;A65 ;O89     ;0;9
M4274   ;be unique number reason first be be not se register investment company put asset coverage requirement % oppose %;A65 ;O9      ;1;18
M4275   ;encourage management issue positive outlook fiscal expect strong momentum continue;A65 ;O90     ;1;9
M4276   ;remain impress s robust growth product innovation have help deliver positive earn surprise straight quarter now;A65 ;O91     ;1;15
M4277   ;Further company aim increase global reach market share expand operation emerge market focus digital development direct-to-consumer business other brand;A65 ;O92     ;0;18
M4278   ;However unfavorable currency fluctuation remain matter concern;A65 ;O93     ;0;6
M4279   ;Also company remain prone soft economic environment risk operate overseas markets. wa downgrade analyst hold rat;A65 ;O94     ;0;15
M4280   ;PBSFF have buy rat reiterate analyst;A65 ;O95     ;5;5
M4281   ;have hold rat reiterate analyst;A65 ;O96     ;7;4
M4282   ;wa downgrade analyst buy rat hold rat;A65 ;O97     ;7;6
M4283   ;According exhibit mix performance first quarter fiscal earn beat revenue miss same;A65 ;O98     ;0;11
M4284   ;Incidentally reorder sale growth quarter fail fully offset decline new order sale;A65 ;O99     ;0;11
M4285   ;wa president implicate coverup politically motivate break have just resign disgrce;A66 ;O1      ;1;10
M4286   ;slam fist table emphasis see footprint shag carpet;A66 ;O10     ;2;7
M4287   ;generally end conversation retreat room continue eye younger sibling lens dark suspicion;A66 ;O11     ;2;11
M4464   ;More Noise;A70 ;O33     ;1;1
M4288   ;then brother determine fight fire fire — trot do-it-yourself security system set alarm bell time intruder trip hide wre;A66 ;O12     ;1;18
M4289   ;next time sneak check record action figure;A66 ;O13     ;1;6
M4290   ;Equally inspire place glass water top door frame drench unwanted visitor simply tack piece cardboard crude warn KEEP;A66 ;O14     ;0;17
M4291   ;jag letter door;A66 ;O15     ;1;2
M4292   ;Only sweet trust six-year-old wa dark blithely older brother sneak room eat powder cake mix oven help ourselves whatever coin find piggy bank;A66 ;O16     ;0;22
M4293   ;so live eye other warily other possession guard own prison screw Sing;A66 ;O17     ;1;11
M4294   ;Confrontations naturally be inevitable;A66 ;O18     ;0;3
M4295   ;be snoop room;A66 ;O19     ;2;2
M4296   ;be not crook;A66 ;O2      ;2;2
M4297   ;"";A66 ;O20     ;0;0
M4298   ;Yes;A66 ;O21     ;1;0
M4299   ;hook camera heat sensor science kit;A66 ;O22     ;1;5
M4300   ;Here 's infrared image hand hockey card collection;A66 ;O23     ;0;7
